uri,cid,author_did,author_handle,author_display_name,text,created_at,reply_count,repost_count,like_count,indexed_at,langs
at://did:plc:br6gc7le5nafnfxu7bmulwhs/app.bsky.feed.post/3lv6oqlatvu2f,bafyreidijsfbhuokyotfriuf5nm4xjwy7cxlreokdli4qwsa43rsfhawfm,did:plc:br6gc7le5nafnfxu7bmulwhs,julio-barros.bsky.social,Júlio Barros ,"Mas o Agro é Pop, a custa o dinheiro do contribuinte",2025-07-30T13:05:15.932Z,0,0,0,2025-07-30T13:05:16.507Z,['pt']
at://did:plc:eog63hpefo24mxtdzki37ooo/app.bsky.feed.post/3lv6o7tr62c24,bafyreibxt6wkwqjpdtdatmxbpnr7ais2y5gl2mu65h6m4zwqpgp3ywgiky,did:plc:eog63hpefo24mxtdzki37ooo,car0linethais.bsky.social,🇵🇸 caroline with an e 🇵🇸,"Golpes que não caio:

o agro vai entrar em uma crise PROFUNDA pq não vai mais exportar",2025-07-30T12:55:54.837Z,0,0,0,2025-07-30T12:55:55.907Z,['pt']
at://did:plc:6f3ksedanzqgkcehbrb4ccvm/app.bsky.feed.post/3lv6o6poqnc26,bafyreia6lxugntc74pevrevfvkztnoykuhbp4cjxydv6nokajskjqrqhzu,did:plc:6f3ksedanzqgkcehbrb4ccvm,babyface.bsky.social,Douglas,"Agora, troque ""agro"" por""minorias""

Não é mais tão legal, né?",2025-07-30T12:55:17.009Z,1,0,0,2025-07-30T12:55:18.207Z,['pt']
at://did:plc:n7x3qiji5hbgumuj4z63paxm/app.bsky.feed.post/3lv6nb23qu22h,bafyreidvctybl3d7cfppnz4otwl2nncygqhko7hbaqhqnydtwr5n3vdr7i,did:plc:n7x3qiji5hbgumuj4z63paxm,martchelab.bsky.social,O Crono Trigue de Belém,"Enfim - odeio o agro, odeio mineradoras, odeio que o sotaque no sul do meu estado seja influenciado pelo sotaque goiano desses canalhas que vieram roubar nossas terras e odeio o agro",2025-07-30T12:38:41.289Z,2,0,0,2025-07-30T12:39:53.306Z,['pt']
at://did:plc:lr3iqnutaoznq42mwzsg5wff/app.bsky.feed.post/3lv6n75s4sk2o,bafyreige6btykekfj76kntcizmq3ypvp7cd4r5v4muciqhmocr72mhumku,did:plc:lr3iqnutaoznq42mwzsg5wff,wanessacamargos10.bsky.social,Wanessacamargos,"Saudar Ustra no dia do Impeachment da Dilma, falar em metralhar adversários, 700 mil mortes na pandemia, tentativa de golpe 😍😍😍

Mexer com o dinheiro do agro
😡😡😡",2025-07-30T12:37:38.055Z,0,1,3,2025-07-30T12:37:38.911Z,['pt']
at://did:plc:smuh4stdqdw3l7sjf5urqjhy/app.bsky.feed.post/3lv6mvs7xxs2d,bafyreigjmkgq2cz3r2za3cixxxrl3c5aiokwdvg255ankmbrudxjfrh6ym,did:plc:smuh4stdqdw3l7sjf5urqjhy,ildetelopes.bsky.social,Ildete Lopes,"Como assim?????????
Me nego financiar o AGRO golpista.",2025-07-30T12:32:23.940Z,0,0,0,2025-07-30T12:32:25.410Z,['pt']
at://did:plc:3ah7euianvaron24u32iuimy/app.bsky.feed.post/3lv6mjf7g322e,bafyreidlastnlwx63yllwquj6dac2auku56233pgawkmqmphyc27alxkhu,did:plc:3ah7euianvaron24u32iuimy,tomatesahraouie.bsky.social,Tomate sahraouie,"Et un modèle agro exportateur catastrophique, socialement et pour l'environnement. 
Que le Maroc impose au Sahara occidental.
Qui en parle ? tomatesahraouie.wordpress.com 
Comment la Grande Distribution soutient l’exploitation du SAHARA OCCIDENTAL",2025-07-30T12:25:27.636Z,1,0,0,2025-07-30T12:25:31.007Z,['fr']
at://did:plc:n7x3qiji5hbgumuj4z63paxm/app.bsky.feed.post/3lv6mjbdn522h,bafyreibgph3lsj5yybl4pr2wehg537nffov544tledwnqlmdmfyt4b7wpe,did:plc:n7x3qiji5hbgumuj4z63paxm,martchelab.bsky.social,O Crono Trigue de Belém,"Colocando meu chapéu de alumínio e subindo num palanque feito de palito de picolé: o Brasil vai demorar muito, se não for impossível, a se tornar um paz da igualdade enquanto o ""agro"" existir

O agro é ainda uma terra totalmente sem lei que os latifundiários mandam como mandavam séculos atrás",2025-07-30T12:25:23.581Z,1,0,0,2025-07-30T12:26:35.508Z,['pt']
at://did:plc:2mhzphtdaj5icocxvuimmhoz/app.bsky.feed.post/3lv6mis6lnk23,bafyreie5ewekvwqpfyqy5k5rhzjm3cwbuahekymn5nl56sxfhrqga644g4,did:plc:2mhzphtdaj5icocxvuimmhoz,barrgui19.bsky.social,Jaime Guimarães,"Na Bahia o preço da manga caiu 54%. A turma do agro já tá chorando os ""prejuízos"" do tarifaço. Preferem deixar os frutos apodrecerem nos pés a vender para o mercado interno.",2025-07-30T12:25:07.686Z,0,0,0,2025-07-30T12:25:09.306Z,['pt']
at://did:plc:hbtxqyn7b6w5w2uij3ujkwvu/app.bsky.feed.post/3lv6mgkli7s2w,bafyreifwkye7mywqyvix6lrwrs2ot672hrfa5spclmtu32f5pxoipdpzy4,did:plc:hbtxqyn7b6w5w2uij3ujkwvu,isabelczuleta.bsky.social,Isabel Zuleta,"- Entrega de tierras a los campesinos ✔️
- Recuperación del agro ✔️
- Reducción mortalidad infantil por desnutrición ✔️
- Reindustrialización, avanzando EEUU se acaba de dar cuenta de esta necesidad. 
- Salario para soldados y patrulleros ✔️",2025-07-30T12:23:52.581Z,0,0,0,2025-07-30T12:23:52.523Z,['es']
at://did:plc:hm4hsmxsmpr3cllvfddftiua/app.bsky.feed.post/3lv6mea35fc2l,bafyreib2mhu5ofmx2orr66d5tm4s6yid6waq5caxqjlmmp3f3qc7whpzly,did:plc:hm4hsmxsmpr3cllvfddftiua,dulcinea.bsky.social,🥃Dulcinea,"Dia!A obediência servil p/MANTER SEUS PRIVILÉGIOS/IMPUNIDADE E PODER faz do JUDICIÁRIO,LEGISLATIVO E IMPRENSA INIMIGOS DO POVO! INDIGNA É A NAÇÃO Q C COLOCA D 4 p/o estragosunidos,q elegeu o #TRUMPPEDOPHILE! MTO OBRIGADA TRIPRESIDENTE LULA PELO BRASIL SOBERANO! AGRO VENDA➕️ BARATO P/POVO BRASILEIRO!",2025-07-30T12:22:34.426Z,0,3,4,2025-07-30T12:22:39.409Z,['pt']
at://did:plc:eugfmx4lsdspdkq5ndjdzvrv/app.bsky.feed.post/3lv6mbr6he22s,bafyreibdmwrzbtqkj6yxj7qgzelzpkdknmgd6vvscehjonjg6lnzx4uzhq,did:plc:eugfmx4lsdspdkq5ndjdzvrv,kadello.bsky.social,Microwave warrior,"Esse suco de m** deve durar uns 10 anos estocado, e quando vence devem reciclar isso com soda caustica que nem faz com leite, por isso eles não se preocupam. Mas a gente devia se preocupar quando nem na reação a ""esquerda"" o governo pauta melhora pra agricultura que atende nois, ta é coptando o agro",2025-07-30T12:21:11.753Z,0,0,0,2025-07-30T12:21:10.607Z,['pt']
at://did:plc:hehtoygub3fe3fejye7k6wwx/app.bsky.feed.post/3lv6lifu5fs2j,bafyreibv345nthzjwgdodx5hgprfafvu7yz56mi7jxla6donrsegdmr2pu,did:plc:hehtoygub3fe3fejye7k6wwx,erikab1.bsky.social,Erika_b1,"O problema não eh o governo A ou B. São os congressistas que dão subsídios e isenções zilionarias pro AGRO LUCRAR. Aí, ao invés de  VENDER aqui, vendem em DOLAR",2025-07-30T12:07:01.020Z,0,0,1,2025-07-30T12:07:03.107Z,['en']
at://did:plc:nlxguc3mkbfq2kxue666qdym/app.bsky.feed.post/3lv6lgnavh22f,bafyreibuacy7jdy2vbefrxnn2xqva2cc736hvby4ih4n62nscvi474ucxq,did:plc:nlxguc3mkbfq2kxue666qdym,pittyxavier.bsky.social,Priscilla Xavier,O agro é um negócio. Mas com características muito próprias. A que ponto? Já deram demonstrações inúmeras de que preferem descartar mercadoria a escoar no mercado interno ou fazer algum tipo de movimento pela redução da fome em áreas vulneráveis. Por essas e outras não tenho empatia!,2025-07-30T12:06:01.668Z,0,0,0,2025-07-30T12:06:05.212Z,['pt']
at://did:plc:nylvuouiejfot7io2l27kide/app.bsky.feed.post/3lv6lgi4shs2z,bafyreiahriomwa4wx2tugmiy5wdlbxd5pxfskx7wpske5vsll2ca2wuwve,did:plc:nylvuouiejfot7io2l27kide,freiraead.bsky.social,라피,"Brasil tem MUITO alimento. A diferença é que nos alimentamos do que a agricultura familiar produz, enquanto que o agro envia tudo para o exterior. Pois é!",2025-07-30T12:05:56.292Z,0,0,0,2025-07-30T12:05:57.605Z,['pt']
at://did:plc:5igygcmxwz4lek4yoob7usgt/app.bsky.feed.post/3lv6lalqqz22s,bafyreideb3ydnlevy3frykauxhld2khrsikd74bqcn2kdhtzaa6lytmhbi,did:plc:5igygcmxwz4lek4yoob7usgt,eduardokafer.bsky.social,Eduardo Kafer,"""O agro alimenta o Brasil"". O agro quer é lucro. Se puder vender em dólar e ver a gente passando perrengue, eles não tão nem aí.",2025-07-30T12:02:38.761Z,0,0,1,2025-07-30T12:02:41.205Z,['pt']
at://did:plc:udxobhxglzf2p6raewiedvth/app.bsky.feed.post/3lv6l662od22w,bafyreietqeslqhltby24ekqkdgymuiar3yyfuoshn7bva5nrb2afxm4zd4,did:plc:udxobhxglzf2p6raewiedvth,condepaspalho.bsky.social,Leia Jiraishin,Eu quando sou Brasileiro e o agro tem que vender tudo mais barato,2025-07-30T12:01:17.300Z,0,2,4,2025-07-30T12:01:19.210Z,['pt']
at://did:plc:razafgyj7hhusljz5gcmrgzj/app.bsky.feed.post/3lv6kprqnxs2v,bafyreifqo36keqqq4h6a6oyyw6cuholvhl2m2kuh7orfvi5gjoxkhm4idq,did:plc:razafgyj7hhusljz5gcmrgzj,marelhos.bsky.social,Marelhos,O agro é morte,2025-07-30T11:53:14.628Z,0,0,0,2025-07-30T11:53:15.605Z,['pt']
at://did:plc:gkivphikfy4olkmweuogups6/app.bsky.feed.post/3lv6kckqyek2r,bafyreigr7ca2mys2l3brc37daddyaj6oezclkil3ean6zsnrwrcrpvh3ky,did:plc:gkivphikfy4olkmweuogups6,procurandosair.bsky.social,,"A questão central o povo acordar  entender de fato como as coisas são e se levantar contra essa elite 
Sei que é difícil, mas temos uma ótima oportunidade de acordar alguns pra entender que o Agro é o maior sanguessuga desse país 
Gera pouco emprego, mamam nas tetas do governo, pra enriquecer poucos",2025-07-30T11:45:51.091Z,0,0,1,2025-07-30T11:45:51.910Z,['en']
at://did:plc:2yweufms6o2mvtheib6b6vj3/app.bsky.feed.post/3lv6k23cils2p,bafyreigxhvcz3oitwjvw4rwfskf5lt6fd4sfh3ubjvsl7vturw6hjntwe4,did:plc:2yweufms6o2mvtheib6b6vj3,fk19121966.bsky.social,,"EFEITO BOLSONARO
www.brasil247.com/agro/exporta...",2025-07-30T11:41:06.451Z,0,0,0,2025-07-30T11:41:15.308Z,['pt']
at://did:plc:tirutta4zevidpwfuht7csdi/app.bsky.feed.post/3lv6jz6cjbs2o,bafyreiakqrnrfbl3bkwp44lq5wh7hkpt7y3tfn5gov5f4ed6s7rxjyeire,did:plc:tirutta4zevidpwfuht7csdi,priskika.bsky.social,Namorada reborn,"O agro lucra com a fome do brasileiro. Agro é fome, trabalho escravo, devastação e morte.",2025-07-30T11:40:36.042Z,0,8,20,2025-07-30T11:40:36.306Z,['pt']
at://did:plc:43jiklmif2excm3b2rngeawc/app.bsky.feed.post/3lv6jxnd33c2m,bafyreihhpnllt7e62uptke5l7srrgqocjibx2kpysr4hem62ah53snv6da,did:plc:43jiklmif2excm3b2rngeawc,gasseruto.bsky.social,Laura,"o brasileiro descobrindo que tem comida o suficiente no país pra ninguém passar fome e todo mundo comer bem, mas que o agro direciona tudo pra fora.",2025-07-30T11:39:44.682Z,0,25,62,2025-07-30T11:39:45.207Z,['pt']
at://did:plc:f3pc53tz35mrvuw7vzjeikww/app.bsky.feed.post/3lv6jcusfe224,bafyreifehd5efdkr2wwlxnho22u426cy5oimlgvnhac4w5osjul2xed3r4,did:plc:f3pc53tz35mrvuw7vzjeikww,pudimon.bsky.social,oran berry do amor,"ah sim um editorial do estadão condenando um bolsonaro, algo que se vê todo dia

espero que continue assim depois que passar a raivinha do agro",2025-07-30T11:28:07.881Z,0,0,1,2025-07-30T11:28:08.108Z,['pt']
at://did:plc:56hquzq7k6l2isqqkchsmo2y/app.bsky.feed.post/3lv6j7qkxns2h,bafyreiewgs4o765cjkagmiucqoqoq2deez7syj6hruabrimmccmpebyqvi,did:plc:56hquzq7k6l2isqqkchsmo2y,cacobrasil2.bsky.social,CACO BRASIL 2,"EXPORTADORES PERDEM BILHÃO MAS NÃO VENDEM MAIS BARATO PRO POVO BRASILEIRO ...  
ELES SABEM QUE O GOVERNO VAI LIBERAR DIN DIN ...
www.brasil247.com/agro/exporta...",2025-07-30T11:26:22.780Z,0,0,0,2025-07-30T11:26:27.006Z,['pt']
at://did:plc:s6e4dhd3k6i2njlxmgdv5bkw/app.bsky.feed.post/3lv6j2e5stc2i,bafyreie6wmvdrnzdj6masju6lorkjdn3q2skuhlwklolewrthkzha77t3q,did:plc:s6e4dhd3k6i2njlxmgdv5bkw,brunodoamaral.bsky.social,Bruno do Amaral,"Depois da doutrinação com jogos de fazendinha, a Nintendo mostra com a localização do Zelda em português que tem ligações com a bancada agro, entenda:",2025-07-30T11:23:21.990Z,0,0,0,2025-07-30T11:23:25.209Z,['en']
at://did:plc:juijhj3rdgmg6a7wyj2jostp/app.bsky.feed.post/3lv6j2czthk2e,bafyreihih7pxpt6mz3yx3jwlz4vlaaqs5xhfqdb7qfh3vmbebzkpal4dmu,did:plc:juijhj3rdgmg6a7wyj2jostp,saulcastro.bsky.social,,"Laranja estava fora do meu cardápio a tempos,mas ontem paguei 2,90 reais o kilo.
Que se foda o Agro",2025-07-30T11:23:20.814Z,0,1,12,2025-07-30T11:23:22.706Z,['pt']
at://did:plc:sb3iqgtlyzksb2x42my42xvk/app.bsky.feed.post/3lv6inuhjrc2n,bafyreiheqhlck5qvctmdwkgj3fhmpksidbyij2ubuhpu57vu6omkv3ass4,did:plc:sb3iqgtlyzksb2x42my42xvk,noelfilho.bsky.social,Noel Filho,"Aqui o Agro faz e desfaz e nada acontece, sem consequências, os números comprovam que o Agro é o que é pq tem rios de dinheiro público e esse dinheiro não retorna, fica concentrado nas mãos dos latifundiários...",2025-07-30T11:16:22.882Z,0,0,0,2025-07-30T11:16:24.706Z,['pt']
at://did:plc:fkq5v4vxrquwqijpejjvvuwb/app.bsky.feed.post/3lv6igvzejc2p,bafyreifd5y4edwi5l7mujmwwesabdmqulljajb4hlwl3zihyl2i7o2w4wa,did:plc:fkq5v4vxrquwqijpejjvvuwb,jemimasvintage.bsky.social,,"he’s out here calling leftists Eva Braun & neo-n*zi, actively looking for agro? I don’t mind his combativeness, in fact, I think its BETTER to stand up like that. but his targets? most have been leftist. I checked him out to see y. meanwhile his minions: ‘you cannot SPEAK *to or about* our lord’ 🙄🙄",2025-07-30T11:12:29.632Z,1,0,0,2025-07-30T11:12:31.009Z,['en']
at://did:plc:b7wff6nbbqpvv2ery7sakhna/app.bsky.feed.post/3lv6hn2arqs2x,bafyreic2vbdbl2cgocl5rpg4l54bltw35i6ej2q76jjmmr7nkmehipa42u,did:plc:b7wff6nbbqpvv2ery7sakhna,luiscoml.bsky.social,Obby Oszourne,Bolsonaros ou a grana do agro: uma escolha nada difícil.,2025-07-30T10:58:01.655Z,0,1,3,2025-07-30T10:58:05.514Z,['pt']
at://did:plc:pyj7jgvx7hpyfj3ytctytjpy/app.bsky.feed.post/3lv6h2vsjrk2t,bafyreifn6mdpfwbocci3qdjbkj2vapsjp47fbl3rl6rwmslstfg3lvn4ti,did:plc:pyj7jgvx7hpyfj3ytctytjpy,disnelson74.bsky.social,Disnelson,Esse Agro já deveria ter perdido as benesses do governo a muito tempo.,2025-07-30T10:47:53.015Z,0,1,2,2025-07-30T10:47:54.108Z,['pt']
at://did:plc:fkq5v4vxrquwqijpejjvvuwb/app.bsky.feed.post/3lv6gzclwa22p,bafyreigiwiuym2menhgdvi2oeqqeean2galptvcz6m6hzefbf77nreedti,did:plc:fkq5v4vxrquwqijpejjvvuwb,jemimasvintage.bsky.social,,"almost all a/c’s Kweli argues with are left wing. wen yer check the a/c’s out? it’s all good. ok yes, some truly are WNKRS but most? all good. I’m gonna continue testin this hypothesis bc he’s clearly LOOKIN for agro. he summoned *me* this time btw, which I don’t mind but b prepared to DEAL ffs 🤷‍♀️🤷‍♀️",2025-07-30T10:46:59.319Z,1,0,0,2025-07-30T10:47:00.607Z,['en']
at://did:plc:tcya7euhn3pgh7jldmufu5vs/app.bsky.feed.post/3lv6gpkzhk224,bafyreig3cs6qszijogyjtqozqgwrx5eyfrhja4c4hq4rba3bfvkxdtx5fi,did:plc:tcya7euhn3pgh7jldmufu5vs,ninadramas.bsky.social,Nina,"É sobre isso 💅💅💅 tenho muitas preocupações na vida, nenhuma relacionada a quanto o agro vai deixar de ganhar kkkk",2025-07-30T10:41:32.608Z,1,0,1,2025-07-30T10:41:34.811Z,['pt']
at://did:plc:z7lkqlobtsv7jpm6l7xovomc/app.bsky.feed.post/3lv6ghgmzts26,bafyreib6qis66r54fjcabvr4sghr7dsuv6budoyt7jd272rbkhs7g7iipq,did:plc:z7lkqlobtsv7jpm6l7xovomc,brasil247.bsky.social,Brasil 247,"Exportações de carne para os EUA despencam e Marfrig suspende produção em Mato Grosso
www.brasil247.com/agro/exporta...",2025-07-30T10:36:59.572Z,0,0,12,2025-07-30T10:36:46.407Z,['pt']
at://did:plc:rlsbh33ybz25hkevctidssxe/app.bsky.feed.post/3lv6gazwxck22,bafyreidhhspyj7cvvoctn4p3r65eg4u6xx6bravpqyd2akcoeikcjzetda,did:plc:rlsbh33ybz25hkevctidssxe,bethlucida.bsky.social,Bethlucida,Exportações de carne para os EUA despencam e Marfrig suspende produção em Mato Grosso www.brasil247.com/agro/exporta...,2025-07-30T10:33:24.938Z,0,0,0,2025-07-30T10:33:31.908Z,['pt']
at://did:plc:hycn5zlofz7gdlx3axgeivan/app.bsky.feed.post/3lv6fyqxfm22e,bafyreicnn7bz5yyfkyxyqrwknkon2dtjrflwcninuj6scjejnxjfcsunlm,did:plc:hycn5zlofz7gdlx3axgeivan,cloovis.bsky.social,Cloovis,"Samuel Étienne, celui qui a fait une sponso lobby agro industriel qui a participé à l’écriture de la loi duplomb ? Un moment faudrait que ça lui retombe un peu dessus non ? Tous le monde a oublié ? Lobby et influence ont amené cette loi…",2025-07-30T10:28:47.080Z,2,0,2,2025-07-30T10:28:47.905Z,['fr']
at://did:plc:eoie5lk6kyy5epjengk6hbfx/app.bsky.feed.post/3lv6fm5baqk2n,bafyreigjsuhvzun5qb6qlnbnaz6vmkfougpabmfqdwmsmctdpuagyktyom,did:plc:eoie5lk6kyy5epjengk6hbfx,principeestranho.bsky.social,Principe Estranho 👑,"Pecuarista envolvida com o PCC é uma das maiores doadoras da campanha do Cara de Areia Mijada.

O agro é crime organizado!

jornaldebrasilia.com.br/noticias/pol...",2025-07-30T10:21:43.778Z,0,1,2,2025-07-30T10:21:45.409Z,['pt']
at://did:plc:74xjlh7ae6jcdhstrjcx4vsx/app.bsky.feed.post/3lv6fkufe7c2l,bafyreib5ktwhjxcep7d6kan3jh4bqqsv5wukb2hzl3feml2uxzytmrcsmq,did:plc:74xjlh7ae6jcdhstrjcx4vsx,baruquinhobr.bsky.social,Theo Baruquinho - Brasil SOBERANO 🇧🇷,"O Agro produz commodites 

A Agricultura Familiar produz comida",2025-07-30T10:21:00.922Z,0,0,6,2025-07-30T10:21:05.705Z,['pt']
at://did:plc:zvnazwflp7aeqhgy22y6zy2f/app.bsky.feed.post/3lv6ekz3vg22n,bafyreidpdnqfg7hhna4pogmz5taa2b7t6ovmsgq65o62ie4elunz4zboqa,did:plc:zvnazwflp7aeqhgy22y6zy2f,aijastacenko.bsky.social,Aija Stacenko,"Haha. Es sevišķi nevaru ciest agro pļaušanu, pie manējiem Kārsavā dažreiz 6 sāk. Traki bija jūnijā, kad tikai 2 dienas no 20 nelija, tad to vien kā pļaušanu dzirdēja.",2025-07-30T10:03:12.113Z,0,0,1,2025-07-30T10:03:28.507Z,['en']
at://did:plc:74xjlh7ae6jcdhstrjcx4vsx/app.bsky.feed.post/3lv6ekd44vs2l,bafyreieu4tomiwsq37sm54a3ustz4bgcgk2gtd6exf53cf2mayjyzhwlu4,did:plc:74xjlh7ae6jcdhstrjcx4vsx,baruquinhobr.bsky.social,Theo Baruquinho - Brasil SOBERANO 🇧🇷,Não gosto e nunca gostei do Agro Pop,2025-07-30T10:02:49.052Z,0,1,2,2025-07-30T10:02:53.007Z,['pt']
at://did:plc:3ah7euianvaron24u32iuimy/app.bsky.feed.post/3lv6c5xyjtk2m,bafyreiedakzlzwv4ek6oojulpwnmrm5gkq2sfgdsxiomvkrugi3m5bg3gm,did:plc:3ah7euianvaron24u32iuimy,tomatesahraouie.bsky.social,Tomate sahraouie,"Et un modèle agro exportateur catastrophique, socialement et pour l'environnement. 
Que le Maroc impose au Sahara occidental.
Qui en parle ? tomatesahraouie.wordpress.com 
Comment la Grande Distribution soutient l’exploitation du SAHARA OCCIDENTAL",2025-07-30T09:20:07.263Z,0,0,0,2025-07-30T09:20:10.108Z,['fr']
at://did:plc:3ah7euianvaron24u32iuimy/app.bsky.feed.post/3lv6c57y7vk2m,bafyreigqm3hp6bqe6v7bkczlawhaoectxxnj5czqaj7zqa3qhctjqtfeny,did:plc:3ah7euianvaron24u32iuimy,tomatesahraouie.bsky.social,Tomate sahraouie,"Et un modèle agro exportateur catastrophique, socialement et pour l'environnement. 
Que le Maroc impose au Sahara occidental.
Qui en parle ? tomatesahraouie.wordpress.com 
Comment la Grande Distribution soutient l’exploitation du SAHARA OCCIDENTAL",2025-07-30T09:19:42.087Z,0,0,0,2025-07-30T09:19:45.005Z,['fr']
at://did:plc:3ah7euianvaron24u32iuimy/app.bsky.feed.post/3lv6c4yl6ws2m,bafyreih2hjl2tqhra6dla2gueqkf6hlv7er7geyw5g3ty76cyvdj7ihw2i,did:plc:3ah7euianvaron24u32iuimy,tomatesahraouie.bsky.social,Tomate sahraouie,"Et un modèle agro exportateur catastrophique, socialement et pour l'environnement. 
Que le Maroc impose au Sahara occidental.
Qui en parle ? tomatesahraouie.wordpress.com 
Comment la Grande Distribution soutient l’exploitation du SAHARA OCCIDENTAL",2025-07-30T09:19:34.320Z,0,0,0,2025-07-30T09:19:37.207Z,['fr']
at://did:plc:hycn5zlofz7gdlx3axgeivan/app.bsky.feed.post/3lv6c3nz6xc2g,bafyreihxytzjrbp6hkyj7rzl4zch4vvfdwiqaohvyt5br5k2a4dlsa6wsq,did:plc:hycn5zlofz7gdlx3axgeivan,cloovis.bsky.social,Cloovis,Samuel Étienne était au salon de l’agriculture en partenariat avec intercereales (lobby agro industriel qui a contribué à l’écriture de la loi du plomb) sera au zevent pour booster sa carrière internet après avoir pris son chèque des gros céréaliers … ou est la cohérence ?,2025-07-30T09:18:49.689Z,1,0,4,2025-07-30T09:18:50.405Z,['fr']
at://did:plc:n42bfck3teljz22nluusqnyi/app.bsky.feed.post/3lv6b32mgtw2f,bafyreihriyen7skti4vzhra3vdyrite7zhjzf62n5nq4kg7usosmapboem,did:plc:n42bfck3teljz22nluusqnyi,folhadecuritiba.bsky.social,,"Marrocos Aposta no Agro Brasileiro: Acordos Comerciais Podem Impulsionar Setor, Afirma Embaixador #curitiba #folhadecuritiba",2025-07-30T09:00:37+00:00,1,0,0,2025-07-30T09:00:35.806Z,[]
at://did:plc:3ah7euianvaron24u32iuimy/app.bsky.feed.post/3lv6alljqpc2z,bafyreiauk3c7m6wceua5dujttoaejmdqwxlkl63vzgg7hz2vtprktrt6ii,did:plc:3ah7euianvaron24u32iuimy,tomatesahraouie.bsky.social,Tomate sahraouie,"Le Maroc s’engage fermement pour des systèmes alimentaires durables et inclusifs dakardirect.tv/2025/07/29/l...  
Tout est faux. Le système agro exportateur marocain est une cata sociale et environnementale. Et imposé au Sahara occidental tomatesahraouie.wordpress.com",2025-07-30T08:51:56.473Z,0,0,0,2025-07-30T08:51:58.910Z,['fr']
at://did:plc:ikwl3tokh5cmi6znqziepxbj/app.bsky.feed.post/3lv6ab554rs2u,bafyreicakuv4ylqmoqlu4nu53zgnfrmlztkymfbjcnador3eyt7kepdpka,did:plc:ikwl3tokh5cmi6znqziepxbj,remixcoux.bsky.social,,"Bonjour, av quelle casquette avez vous écrit ce poste svp? Lobbyiste de l'industrie phyto/agro, influenceuse anti sciences/désinformation ou pro génocide?",2025-07-30T08:46:05.836Z,0,0,0,2025-07-30T08:46:07.309Z,['en']
at://did:plc:hycn5zlofz7gdlx3axgeivan/app.bsky.feed.post/3lv67s6h4ys2g,bafyreibdlrlabhgj4hlxskhzkobswzz46g5246qx64zbrl4ijmzx4y2ida,did:plc:hycn5zlofz7gdlx3axgeivan,cloovis.bsky.social,Cloovis,Et Samuel Étienne qui fait la promo du lobby agro industriel il y’a quelques mois (ceux à l’origine de la loi duplomb) et fais son green washing au zevent c’est ok ?,2025-07-30T08:37:43.895Z,0,0,5,2025-07-30T08:37:44.704Z,['fr']
at://did:plc:e6fbses2soozqkyskxr7ujus/app.bsky.feed.post/3lv67atmtck22,bafyreicw77ey3t2pfbcfuo3sdxultl3axo3uvwf3kxvd6w63xypbaf4nt4,did:plc:e6fbses2soozqkyskxr7ujus,tgazcarate.bsky.social,Tomas García Azcarate,"La EFSA ha analizado 47 plagas que amenazan al agro en la Unión Europea - A en verde - Medio de información de agricultura

www.aenverde.es/la-efsa-ha-a...",2025-07-30T08:28:02.123Z,0,0,0,2025-07-30T08:28:06.509Z,['es']
at://did:plc:x6rdocngt7rrysy2zfe4bfvm/app.bsky.feed.post/3lv675of7dk2l,bafyreiepo5dzqfigao44tqhw3sxclbpnpy2c3savpjfbdke4hptjztf22y,did:plc:x6rdocngt7rrysy2zfe4bfvm,robswinkels.bsky.social,Rob Swinkels ,"Alsmede lobbyist van de Agro-industrie, wat dan de overstap naar de partij van en voor de Agro-industrie beter verklaard.",2025-07-30T08:26:15.967Z,0,0,0,2025-07-30T08:26:15.906Z,['nl']
at://did:plc:2uy6zotjqd5mfgdrlsco3xm6/app.bsky.feed.post/3lv66sc3t7c2z,bafyreib3h5dvmh7jyfu6wltmd6djkrvqc3smejanyph256rspxbjajapb4,did:plc:2uy6zotjqd5mfgdrlsco3xm6,alberipetersen.bsky.social,Alberi Petersen,"O agro que subsidiamos com nossos impostos no seu estado mais puro!
www.cnnbrasil.com.br/economia/mac...",2025-07-30T08:19:53.978Z,0,1,5,2025-07-30T08:19:58.911Z,['pt']
at://did:plc:xo2qz65twudxqzk6cl5m277s/app.bsky.feed.post/3lv66nzg6dq2a,bafyreihwniwb3mfqfvsgo7uxnpv2zku5amtud3jrkjwj5jst3puawgyiua,did:plc:xo2qz65twudxqzk6cl5m277s,gorekhaa.bsky.social,[G.R.K.]©️😷👽🏴🏳️‍🌈🏳️‍⚧️Ⓐ💣🌏🌀 Your Daily Fix of Subversion,"ses épisodes caniculaires. Elles sont également victimes de l’érosion de la biodiversité, accélérée par les pratiques agro-industrielles encouragées par la loi Duplomb. Entre canicules et épisodes de [2/2]",2025-07-30T08:17:08.829Z,0,0,0,2025-07-30T08:17:31.609Z,['fr']
at://did:plc:hycn5zlofz7gdlx3axgeivan/app.bsky.feed.post/3lv665nlnrs2g,bafyreidjaolfbdi4skvh5txc5hno3bauaeoyemyr2wuskibwh6addezyn4,did:plc:hycn5zlofz7gdlx3axgeivan,cloovis.bsky.social,Cloovis,"Hello, merci pour ta prise de position. Ça serai bien aussi de s’en prendre un peu à Samuel Étienne , qui a fait la promo du lobby agro industriel il y’a quelques mois au salon de l’agriculture (qui a donc participé activement à la possibilité de la loi duplomb). Et lui sera en physique au zevent…",2025-07-30T08:08:21.387Z,0,0,4,2025-07-30T08:08:22.409Z,['fr']
at://did:plc:r3agi2covli6gmmdm2343toh/app.bsky.feed.post/3lv6636sg3s2b,bafyreig4tfobwoaodscivvhu5xyelhuqzpr2i6u3t2biw2jqyw53ryhocy,did:plc:r3agi2covli6gmmdm2343toh,plopuitputh.bsky.social,Fella ötpöt2  🔔🌈🇳🇱🦈,Zolang de invloed v agro-industrie lobbyclubs niet aan banden wordt gelegd zal dit soort perverse uitingen niet minder worden. Het zou me trouwens niks verbazen als die lobbyclubs met Europees subsidiegeld worden gefinancierd.🤔,2025-07-30T08:06:58.771Z,1,0,1,2025-07-30T08:06:59.508Z,['nl']
at://did:plc:ip4hr5lmljzjzwqe7h6jjaij/app.bsky.feed.post/3lv65qdgbcc2h,bafyreib6tf6y7ptzniygckjk6mtgm63zcdxl47np5254qslwnnrudqwuly,did:plc:ip4hr5lmljzjzwqe7h6jjaij,mcnultyrulez.bsky.social,Daniel A. A.,Agro,2025-07-30T08:00:54.518Z,0,0,0,2025-07-30T08:00:55.006Z,['es']
at://did:plc:3uy56pks7i5vkqug4rmwlgvq/app.bsky.feed.post/3lv64eqhtmc2q,bafyreic223zlzr76runjmhdnt7bjotqwl4i22lcggocsqlh3ocgemjldsq,did:plc:3uy56pks7i5vkqug4rmwlgvq,sjochmarris.bsky.social,Bert,ziet hier de extreemrechtse dader Caroline van de BBB die het geld steelt voor Big-Agro industrie ipv zorg en armoede bestrijding,2025-07-30T07:36:31.788Z,0,0,0,2025-07-30T07:36:56.907Z,['en']
at://did:plc:qvrdxwqxxvqfaycvka56zvfp/app.bsky.feed.post/3lv5wx52aq22w,bafyreicl3yj2i6zxbkkzoonu5kh3r2w4myr4cs3fq6jydpifq6h5ccj6pq,did:plc:qvrdxwqxxvqfaycvka56zvfp,teme.bsky.social,ChefTeme 🦻,"Un barrio de Barcelona. ¿Donde está la originalidad? Antes ibas a otra provincia a comprar cosas distintas de las tuyas, ahora eso es impensable. Mejor en el Agro, os lo puedo asegurar.",2025-07-30T05:59:25.789Z,0,0,1,2025-07-30T05:59:25.730Z,['es']
at://did:plc:ge4t65gmjcnqulavviuk5xdg/app.bsky.feed.post/3lv5w5t4z622i,bafyreicqh5ew2f7kjoft7y77madcfmivkjgcc7ooyhd3yreyjvoi2bkdcy,did:plc:ge4t65gmjcnqulavviuk5xdg,24strandjutter.bsky.social,Eric H.,"Kan worden opgeteld bij de miljardensubsidies die agro al krijgt.

Het is maar goed dat de dieren vanuit hun donkere stallen niet om uitleg vragen, want hoe ?? Het is niet uit te leggen.",2025-07-30T05:45:17.265Z,1,0,0,2025-07-30T05:45:18.315Z,['nl']
at://did:plc:4o7447z6ntcrryqmhu7xiqfx/app.bsky.feed.post/3lv5w5ixyrk2e,bafyreic3eavisinykla2aq36ctv7wqggpk36q7r245mlp5fqkakw2coiti,did:plc:4o7447z6ntcrryqmhu7xiqfx,virusdotexe.bsky.social,Virus.exe,"War bei meiner Omi auch. Ich war vor meiner Mutter aus ihrer Erinnerung verschwunden. Sie meinte es nicht böse, daher war ich fein damit. Aber meine Mutter ist jedesmal voll agro geworden & hat sie übel ausgeschimpft, wenn sie nicht wusste wer ich bin. Omi war trotzdem lieber bei mir als bei ihr. 🥹",2025-07-30T05:45:06.614Z,1,0,2,2025-07-30T05:45:07.209Z,['de']
