uri,cid,author_did,author_handle,author_display_name,text,created_at,reply_count,repost_count,like_count,indexed_at,langs
at://did:plc:jfpde4ozuhi5m5evsgld3r54/app.bsky.feed.post/3luzlxtfuo22v,bafyreih4hrbskkile5wpivybcro7aafzzdj2pu42s3onqf4qyhtoutpase,did:plc:jfpde4ozuhi5m5evsgld3r54,waf1945.bsky.social,,"Governo Lula celebra Dia do Agricultor com AgroAmigo, programa de crédito bilionário www.brasil247.com/agro/governo...",2025-07-28T12:32:19.854Z,0,0,0,2025-07-28T12:32:33.804Z,['pt']
at://did:plc:xhpdeow2frlfjvzoksjcmvhd/app.bsky.feed.post/3luzlikr6nc2k,bafyreiaqohp4m65gzhl2y7zu7v45q4qvovr3r6v5of2qgnfjyfj6ikict4,did:plc:xhpdeow2frlfjvzoksjcmvhd,paco15.bsky.social,François Arias,dans son CV pardon. Après on peut discuter des allez retour public/privé cradingues et du fait que Sophie Primas ait une pellétée de casseroles aux cul et soit une agronome maquée avec l'industrie agro alimentaire mais c'est un autre souci.,2025-07-28T12:23:47.474Z,0,0,1,2025-07-28T12:23:56.908Z,['fr']
at://did:plc:jalqqkmtzkkifjbj7mmzcvrd/app.bsky.feed.post/3luzl5jipi22z,bafyreicrbijezwfp2ibntu76wuiih5w4zo5siafmwpjulunravsogny774,did:plc:jalqqkmtzkkifjbj7mmzcvrd,whitedreads.bsky.social,Simply WAR Dreads,Rode past this place called the Agro Center and felt drawn to it like nowhere else on earth,2025-07-28T12:17:37.047Z,0,0,3,2025-07-28T12:17:38.309Z,['en']
at://did:plc:ygxcroejzo7k6xthrh2vwigf/app.bsky.feed.post/3luzkpe5uq22e,bafyreicbwugwpfvzbn4c7k4rjgd5eysq7ufxe6ljzfqsuyf4bhcpdwhdli,did:plc:ygxcroejzo7k6xthrh2vwigf,smartlivros.bsky.social,notícias & cultura,"Governo Lula celebra Dia do Agricultor com AgroAmigo, programa de crédito bilionário www.brasil247.com/agro/governo...",2025-07-28T12:09:41.688Z,0,0,0,2025-07-28T12:09:48.907Z,['pt']
at://did:plc:2nl3ygjotysmnj6dr22jrhju/app.bsky.feed.post/3luzkj2xdjk2v,bafyreihysio2cql6grwz2flvdzwc6aovxoqi3hw7zux7t45tkioxvsgwg4,did:plc:2nl3ygjotysmnj6dr22jrhju,xykosancho.bsky.social,Chico Sancho,"O ex-presidente sempre foi hábil em capitalizar para si o sentimento antipetista no mundo agro, mas nunca fez nada de muito extraordinário em favor do setor.
ESTADÃO",2025-07-28T12:06:10.711Z,0,0,0,2025-07-28T12:06:11.203Z,"['en', 'fr']"
at://did:plc:lpvdw7g3b4nsicikvtnwjikv/app.bsky.feed.post/3luzjy4g6v22x,bafyreialxwjv2supssjyqksd25rpblbs6p7gnvwfw5x6vinj4aq4vcl7za,did:plc:lpvdw7g3b4nsicikvtnwjikv,furax2a.bsky.social,,Les agro - terroristes dans toute leur horreur 🤢🤮 !,2025-07-28T11:56:41.820Z,0,0,2,2025-07-28T11:56:42.505Z,['fr']
at://did:plc:dk644jtqur3mvxphdwuawi25/app.bsky.feed.post/3luzjrjdelk2m,bafyreiemvrojayphirubf3nraqtohdde2rxpu7xy5ytfr6ovbyrxocgssm,did:plc:dk644jtqur3mvxphdwuawi25,marcianobrito.bsky.social,Marciano Brito,"Governo Lula celebra Dia do Agricultor com AgroAmigo, programa de crédito bilionário www.brasil247.com/agro/governo...
Inspirado em experiência bem-sucedida no Nordeste, novo programa de microcrédito do governo federal oferece até R$ 1 bilhão a agricultores familiares",2025-07-28T11:53:00.478Z,3,21,77,2025-07-28T11:53:07.909Z,['pt']
at://did:plc:co4gkmcaxk32r6dijov5e3mm/app.bsky.feed.post/3luzix7g4nw2d,bafyreih6ep27dp3yhvhkzcnjngajapnnjuhoqocg6uvfnbgfenc7uvnlsu,did:plc:co4gkmcaxk32r6dijov5e3mm,alealcantara.bsky.social,,"Morango do amor é invenção mais v3lh∆ q o traseiro da minha avó, mas do nada a imprensa Ԁo1Ԁa inventou q isso seria a novidade do momento! 🤪 Os caras inventam essa m3rԀa, p/ tentar disfarçar q o pessoal do agro tá desesperado p/ vender morango, pq exportar p/ States deu ruim! 😆🤌🏼",2025-07-28T11:39:33.852Z,0,0,0,2025-07-28T11:38:17.807Z,['pt']
at://did:plc:us3rnlvvjk47hunfm3erbk3c/app.bsky.feed.post/3luzimrybvk22,bafyreid2zg2l2pdzajvxxncmbmk6bwixcm7hkejo56hduqxre2ux4xipzy,did:plc:us3rnlvvjk47hunfm3erbk3c,hamorc.bsky.social,Akennaton,"O criminoso Agro-Negócio Latifundiário brasileiro apoiou e financiou o Fascismo Evanjegue Pentelhocostal Assembleiano Bolsojeguiano. Agora estão tomando no cú com o tarifaço do Trump, graças aos Bolsonaros.
BEM FEITO!!!!!",2025-07-28T11:32:28.020Z,0,0,1,2025-07-28T11:32:34.007Z,['pt']
at://did:plc:qebffbxoqsxcoz22rrwzqxwo/app.bsky.feed.post/3luzibadncc2t,bafyreif3g5pb5qjlpkmx5yr7eswtwug6ovr5jqx2ognnqq2vmdcmyc5nfa,did:plc:qebffbxoqsxcoz22rrwzqxwo,anderlia.bsky.social,,"2342 signatures pour la contre-pétition ""Oui à la loi Duplomb"", quel succès pour les agro-industriels pro-pesticides ! Allez, encore un petit effort, et vous atteindrez le seuil symbolique des 5000 signatures ...

petitions.assemblee-nationale.fr/initiatives/...",2025-07-28T11:26:00.437Z,0,0,0,2025-07-28T11:26:05.701Z,['fr']
at://did:plc:vkkiqzbdar5ntr5qeeiirhep/app.bsky.feed.post/3luzgok7wgc24,bafyreib3rkima5vxrh232lnqpym2olebwr7mpl3tlffke6rwbgmy4uk56e,did:plc:vkkiqzbdar5ntr5qeeiirhep,duncan-waddell.bsky.social,Duncan Waddell,AGRO,2025-07-28T10:57:39.525Z,0,0,0,2025-07-28T10:57:35.303Z,['en']
at://did:plc:2ajhqsgsvhkggaryd66vt3wt/app.bsky.feed.post/3luzfr7txvc2u,bafyreigtip7immcaddvyvrakaen2ipiddv5nxhd3vglx7inxp2nvbi4qi4,did:plc:2ajhqsgsvhkggaryd66vt3wt,vivalogic.bsky.social,Alex H. NoKings 💪,L'usage du sucre est très massivement agro-industriel; supprimer le sachet de sucre blanc sera sans effet. Si la filière est en crise c'est bien plus par des modifications de l'industrie de la malbouffe que par les pucerons.,2025-07-28T10:41:15.569Z,0,0,1,2025-07-28T10:41:15.304Z,['fr']
at://did:plc:pt5chzb7xnboy62m346s5fel/app.bsky.feed.post/3luzex7mls224,bafyreiburxomlsix5vzgr77rlu642bfnfq6zrmvoy5aquzdlwjysutffzy,did:plc:pt5chzb7xnboy62m346s5fel,nhabouzite.bsky.social,Ces chefs d'établissement au dessus-des lois.,"11/n

Jamais je n'ai lu dans les pages de @lavoixdunord.fr un article abordant ce type d'information, ni un témoignage d'un ""agro-industriel pollueur repenti""...

« J’ai hérité d’un cancer et fait des dégâts à cause des pesticides. Des dégâts durables et énormes. »  😱 😨 💀 ☠️

bsky.app/profile/isid...",2025-07-28T10:26:42.912Z,1,23,40,2025-07-28T10:26:35.202Z,['fr']
at://did:plc:mqzrvzbylwpnkah7idrpxar7/app.bsky.feed.post/3luzbtw5xxs2j,bafyreif5s3xqrkiqag4pofrbyv4gdnst6vq4kyavwsfx37fkp3f5byhcgm,did:plc:mqzrvzbylwpnkah7idrpxar7,maartenvra.bsky.social,Maarten,"Niets schreeuwt 'liberale kernwaarde' - waarmee de VVD zichzelf het liefst omschrijft - zo hard als geprefereerde samenwerking met extreem rechts, de populistische Big Agro lobby en christen fundamentalisten.",2025-07-28T09:31:11.108Z,0,1,4,2025-07-28T09:31:11.805Z,['nl']
at://did:plc:3ah7euianvaron24u32iuimy/app.bsky.feed.post/3luz7urhwgc2m,bafyreicvw7qnkglaynq3gdgiel2fe6347m2vcgfcv2b3ugx5cujbll4hby,did:plc:3ah7euianvaron24u32iuimy,tomatesahraouie.bsky.social,Tomate sahraouie,"#Maroc la filière de l’argan en péril face à la sécheresse et à l’exode rural www.geo.fr/environnement/au-maroc-la-filiere-de-largan-en-peril-face-a-la-secheresse-et-a-lexode-rural-227694  
Et le business agro exportateur n'est pas en cause ? 
Exemple avec les tomates tomatesahraouie.wordpress.com",2025-07-28T08:55:52.261Z,0,1,0,2025-07-28T08:55:54.606Z,['fr']
at://did:plc:fq6el4fmztrt5wqvugu6vz2g/app.bsky.feed.post/3luz746t54s2o,bafyreiexeslcux5pakqnqlibvq6sal3ginmbxp3bznmbghzzoqugu652pi,did:plc:fq6el4fmztrt5wqvugu6vz2g,renaudtarlet.bsky.social,Renaud TARLET ,"Et il n'y a aucune pitié à avoir : l'autre gros débouché de la betterave sucrière, ce sont les agro-carburants, qui sont une aberration écocide. 

On impose donc à des millions de personnes les risques sanitaires d'une filière ultra-polluante pour soutenir des productions néfastes qui n'ont ⬇️",2025-07-28T08:42:07.400Z,1,0,2,2025-07-28T08:42:08.003Z,['fr']
at://did:plc:ennh4xtlvqa3tswbbcjfndhk/app.bsky.feed.post/3luz5qnd2tk2v,bafyreiaasctip6nsgvitnnsolwjwjlklord2jl5m7y6q4acbupudnlzmv4,did:plc:ennh4xtlvqa3tswbbcjfndhk,annonymous5112.bsky.social,Annonymous 5112,"Lula é agro.
O trabalhador é quem?
Quem dá crédito ao trabalhador pobre periférico? Ninguém!",2025-07-28T08:17:46.207Z,0,0,0,2025-07-28T08:17:47.005Z,['pt']
at://did:plc:pt5chzb7xnboy62m346s5fel/app.bsky.feed.post/3luz5lumlnk2d,bafyreifuzsudiutepzvt66vetje4m7rtwsdhq43wz5zewvtmqcfsyjr4di,did:plc:pt5chzb7xnboy62m346s5fel,nhabouzite.bsky.social,Ces chefs d'établissement au dessus-des lois.,"Est-ce que ces éléments apparaissent dans les interviews de complaisance et les articles de relais du blablabla des agro-industriles de la FNSEA, dans les pages de @lavoixdunord.fr ?

Il existe 22 alternatives mais les mensonges sont relayés tels quels auprès des lecteurs ?

bsky.app/profile/sylv...",2025-07-28T08:15:06.087Z,2,3,5,2025-07-28T08:14:58.405Z,['fr']
at://did:plc:vxa4cqtga274asrqh5vjt3an/app.bsky.feed.post/3luz3u46ovs2i,bafyreig4qiaatqcrffcjswwzc52ecm2ndx37pgejqbvwarkefdunpalgbq,did:plc:vxa4cqtga274asrqh5vjt3an,solarniasociace.bsky.social,Solární asociace,"Odborná exkurze za poznáním moderní FVE Agro Levín.
Solární asociace ve spolupráci se společností Resalta nabízí svým členům možnost poznat fungování pozemní elektrárny o výkonu 7,5 MWp. Exkurze se koná 13. srpna v Říčanech u Prahy. 
👉 Registrace zde: docs.google.com/forms/d/e/1F...",2025-07-28T07:43:54.952Z,0,0,0,2025-07-28T07:44:04.208Z,['cs']
at://did:plc:t3suxm7ief5dwzoaiof635hc/app.bsky.feed.post/3luz34tl7g22e,bafyreicvltabghvc6waifnf2s2ipqzsncozm2eq6nfxq2piygzzley5jxm,did:plc:t3suxm7ief5dwzoaiof635hc,plucior.bsky.social,,"que foram usados na Pandemia da Covid-19 em caráter EMERGENCIAL para ajudar empregados e empregadores do Agro, da Indústria, do Comércio... É só aproveitar a onde de indignação e patriotismo da população e enquadrar os parlamentares de direita para viabilizar essa ousada possiblidade contra Trump.",2025-07-28T07:30:52.840Z,0,0,0,2025-07-28T07:30:14.846Z,['pt']
at://did:plc:k2kzx3hs2qqzimw4aer5d4sv/app.bsky.feed.post/3luz2lvqqec2f,bafyreib4trqaioogd3mtvvcj6rouos42bc72mfqa2bgplvbnvenxdi3ceu,did:plc:k2kzx3hs2qqzimw4aer5d4sv,fantincroyable.bsky.social,fant1,"La poignée de scientifiques en question : le CNRS agro éco.

Accuser le ptain de CNRS d'être une orga  antisciences... et parler de trumpisme.",2025-07-28T07:21:26.044Z,1,0,0,2025-07-28T07:21:27.602Z,['fr']
at://did:plc:4nwdzb6rwqfwj6hr5fyi7r3r/app.bsky.feed.post/3luyugwqlyk2o,bafyreifnqstxenpumuldmqvt6jv6m4gt5mo4kulnmpqhqzzzmlvk5hbjje,did:plc:4nwdzb6rwqfwj6hr5fyi7r3r,camcantanything.bsky.social,camcantanything,"Agro is so fun to ride, I get to ride him alot that fight cuz it just loves to spawn 8010937628 miles away during the fight lol",2025-07-28T05:31:16.867Z,0,0,1,2025-07-28T05:31:17.703Z,['en']
at://did:plc:4wxxvfo3wvvv575dauv3mygn/app.bsky.feed.post/3luyu3gedf222,bafyreifivcgd5uy6wbmehtet7pbb26s4k4ufwpcmx4jnxpnagitvj6yd6a,did:plc:4wxxvfo3wvvv575dauv3mygn,envoyote.bsky.social,EnvoyOTE,"Yeah if you don't understand how close you need to be to get on, #13 can be a pain. I think I just love riding Agro and making use of him!",2025-07-28T05:24:50.589Z,1,0,1,2025-07-28T05:25:00.805Z,['en']
at://did:plc:gerhh2zkzef2jin7vgomk4c4/app.bsky.feed.post/3luysrce4yc2e,bafyreieisqkgrbf6fharjgxedwlz4lg46argm2x5fwf66qsjrxybw73hbq,did:plc:gerhh2zkzef2jin7vgomk4c4,lucasfer17.bsky.social,Ferreira,O agro é tudo haha,2025-07-28T05:01:17.092Z,0,0,1,2025-07-28T05:01:25.005Z,['pt']
at://did:plc:j6vr6svhcjlewzyw3cmlg4np/app.bsky.feed.post/3luyobny2kk2l,bafyreif4nku7iarsdmtabnzjtpkuam7qxj7mfggmtdurytnhdwjgjqszfe,did:plc:j6vr6svhcjlewzyw3cmlg4np,rod34gt.bsky.social,KenBlck24,Agro*,2025-07-28T03:40:57.449Z,0,0,1,2025-07-28T03:40:57.905Z,['en']
at://did:plc:6fqff5ntgst5zqat2am3bvf4/app.bsky.feed.post/3luynkt32xx2o,bafyreibigaog3sv5wpqjx6nctjatc36zy3ulfrhczxzbg5mwnwnk4zwthm,did:plc:6fqff5ntgst5zqat2am3bvf4,endibot.bsky.social,El Nuevo Día,"Joven pareja levanta agroempresa con una inversión inicial de $7

https://www.elnuevodia.com/negocios/agro/notas/ricura-caribena-en-30-cuerdas-de-terreno/",2025-07-28T03:28:10.826Z,0,0,0,2025-07-28T03:28:11.810Z,['es-PR']
at://did:plc:er4hoqkgma5vx4nvp7r5r77v/app.bsky.feed.post/3luymdx6qz225,bafyreicvummmhjpumda4q4gbnwo3eky4xiifc2b56ucdjhgvxkw6vf4bge,did:plc:er4hoqkgma5vx4nvp7r5r77v,katskitchen.bsky.social,Kats Peterson,"The agro-giants that provide the crap that Walmart sells are the ones that will soon benefit from a new $12 billion subsidy - in addition to all the subsidies they already receive. So now you're not only paying Walmart to pay the agro-giants, you are also paying taxes for their subsidies. Stupid.",2025-07-28T03:06:26.733Z,1,0,0,2025-07-28T03:06:25.805Z,['en']
at://did:plc:ajzjx3odqyfohprxxmwpyyd4/app.bsky.feed.post/3luymcr2l4c27,bafyreig4hpentdccmohdvhexidfcfzblqqhg4ytcgcfy2kejtpcqmzaro4,did:plc:ajzjx3odqyfohprxxmwpyyd4,filipealbani.bsky.social,Filipe Albani,"Filipill 424

Segunda de Primeira
Hoje é dia de quê? Agricultura e Combate às Hepatites Virais
Ressaca do final de semana: Agronegócio X Agricultura Familiar
Gracinha 

#reborn #agro #saude #hepatite #familia #comida #agronegocio #agricultura #inteligenciaartificial #ia #comics #explore #explorar",2025-07-28T03:05:46.747Z,1,0,0,2025-07-28T03:05:50.008Z,['pt']
at://did:plc:zxyeyfkls64xcm6ecrzud5g5/app.bsky.feed.post/3luyjinglfw22,bafyreifrbli7vyhfqkjiqwdi4rbuhboeyxw4zm3nnhnf4326tepdwi3dlu,did:plc:zxyeyfkls64xcm6ecrzud5g5,uol-news.bsky.social,UOL Notícias (Não Oficial),Invisibilidade do pequeno produtor na cadeia do agro desafia sustentabilidade,2025-07-27T23:15:22-03:00,0,0,0,2025-07-28T02:15:23.907Z,['en']
at://did:plc:aduoxavv4nlceto54tgu3fjr/app.bsky.feed.post/3luyiyivoyt2m,bafyreifktwfesv56xp7c4bgd6j5di6jfbovb7ynqahjnwmzea2wmnm75ga,did:plc:aduoxavv4nlceto54tgu3fjr,folha.com,Folha de S.Paulo,Invisibilidade na cadeia do agro desafia sustentabilidade ,2025-07-27T23:06:21-03:00,2,1,2,2025-07-28T02:06:21.605Z,[]
at://did:plc:aduoxavv4nlceto54tgu3fjr/app.bsky.feed.post/3luyiyillvz2c,bafyreifu4trwtdw3msrmgcv42clyrpaklrworpb53ehnrzvvpd3u24kj5u,did:plc:aduoxavv4nlceto54tgu3fjr,folha.com,Folha de S.Paulo,Invisibilidade na cadeia do agro desafia sustentabilidade ,2025-07-27T23:06:20-03:00,1,0,0,2025-07-28T02:06:21.204Z,[]
at://did:plc:djug7xvn7llysoq3ijvzv5vt/app.bsky.feed.post/3luyhku7szc2e,bafyreihwnoeo3zl7vdjahpxxd6r5lgz4pbyyaob2jxjtajctkk67xhjiha,did:plc:djug7xvn7llysoq3ijvzv5vt,goo02.bsky.social,,"Acima de qualquer circunstância o maior prejudicada é o Agro, eu acho pouco. Agora com relação ao trabalhador e triste a realidade.",2025-07-28T01:40:49.793Z,0,0,0,2025-07-28T01:40:53.202Z,['pt']
at://did:plc:77y7ubrpv4u5mfcdw2jt6iej/app.bsky.feed.post/3luyeufugxs2r,bafyreidpvqrok7oeyekbem3muq63pnre774wmq5rs2bjxzlkzcmmomqnoe,did:plc:77y7ubrpv4u5mfcdw2jt6iej,pernascruzadas.bsky.social,Pernas Femininas Cruzadas,"Não acredito que vai conseguir, sobretudo depois dessa aliança absurda com Trump e o tarifaço.

O agro e os empresários abandonaram essa desgraça.",2025-07-28T00:52:29.060Z,0,0,5,2025-07-28T00:52:29.907Z,['pt']
at://did:plc:wpopry72fwwbcqwkc3k6u2ya/app.bsky.feed.post/3luyej7qxts2m,bafyreiddfpdirgzymlfj2ftt5viuovgvowcgdafnwdm7bquhgbnbmljycm,did:plc:wpopry72fwwbcqwkc3k6u2ya,hubdirt.bsky.social,,Is this Agro?,2025-07-28T00:46:13.556Z,0,0,0,2025-07-28T00:46:12.003Z,['en']
at://did:plc:vbrdmoskvdksexq6qy6sklro/app.bsky.feed.post/3luyegw3yyk22,bafyreieszofwnwvdcv5ddbjlfxi2jnonehlbalmwysxbikdcohqhbtvuzq,did:plc:vbrdmoskvdksexq6qy6sklro,franzinha7.bsky.social,Franzinha 🐙♿️,"A mesma política da direita em todo lugar, principalmente nos países em desenvolvimento! Tudo para o agro, nada para os aposentados e universidades, entre outras áreas sociais!",2025-07-28T00:44:56.322Z,0,0,0,2025-07-28T00:44:57.807Z,['pt']
at://did:plc:2qjij4etp5jrqyelyynq7eoc/app.bsky.feed.post/3luydma5ekm2z,bafyreiaftzsqwj4ycicla4mp2w4cr3kurhuumaa6lpzzccuvwas7iwrg5e,did:plc:2qjij4etp5jrqyelyynq7eoc,bworldph.bsky.social,BusinessWorld,"The Farmer Entrepreneurship Program of the Jollibee Group Foundation supports smallholder farmers by providing them with the skills and systems needed to operate as agro-enterprises.

Watch: zurl.co/STNTv",2025-07-28T00:30:00.308Z,0,0,0,2025-07-28T00:30:01.304Z,[]
at://did:plc:2kqccc4ah3r6rc3nnjxddxm6/app.bsky.feed.post/3luyd3dtpcs2f,bafyreiejjecnnwn5bqzb73vprjhautkh5egkm22wrsfsotzy72ftui7oeu,did:plc:2kqccc4ah3r6rc3nnjxddxm6,ericabarbosa.bsky.social,Erica Barbosa,"Ooi minhas estrelas ✨

Hoje tive o prazer de conhecer a incrível @flortvoficial uma pessoa cheia de luz, talento e simpatia, que tantas vezes vi brilhar nas telas da TV brasileira!
.
.
.
.
.
#ericabarbosa #Domingo #Flor #Bazar #brecho #Restaurante #Fazenda #flortv #agro #artista",2025-07-28T00:20:34.335Z,0,0,0,2025-07-28T00:20:35.508Z,['pt']
at://did:plc:6mywpyxrzvnih55djohxuoy4/app.bsky.feed.post/3luyax5cmbk25,bafyreiamscml7s2s6fu3bxewcxlkbariumror5oum755cubkkitusf6o2e,did:plc:6mywpyxrzvnih55djohxuoy4,lucianapmv.bsky.social,Lucy 🌹,"Verdades que nunca são ditas:

Essas são as empresas que fazem girar o Brasil e merecem muito incentivo. Não o agro que só exporta e multinacionais que levam o dinheiro todo pra fora do país",2025-07-27T23:42:25.782Z,0,1,0,2025-07-27T23:42:26.605Z,['en']
at://did:plc:2rsxy2ghoidd573misuatouq/app.bsky.feed.post/3luy7giklxs2f,bafyreiccapi6hi6es3al6n3m4f6s7a26n4guxj6qp5swax4dbos6psk35i,did:plc:2rsxy2ghoidd573misuatouq,luatoni.bsky.social,,Arthur de Lyra ajudando o agro em detrimento dos trabalhadores!!! Sempre o de lyra,2025-07-27T23:15:13.411Z,1,0,1,2025-07-27T23:15:13.809Z,['pt']
at://did:plc:3g27qcyy6juczfbduekqdid6/app.bsky.feed.post/3luy7au7bto24,bafyreic3mb44tt3vnfdcdt7qdd6eucbqfxfkw5e6pyf5mx35zej3qkwbme,did:plc:3g27qcyy6juczfbduekqdid6,merypatriota.bsky.social,Mery Patriota 🇧🇷,"AGRO E PATRIA! GARANTA JÁ! 🇧🇷🚜☀️

👕 Camisa Agro Patriota UV50+
💵 R$79

🔗 https://s.shopee.com.br/1g128vbzmT

#AgroPatriota #OrgulhoBrasileiro #ProtecaoUV",2025-07-27T23:12:03+00:00,0,0,0,2025-07-27T23:12:05.203Z,['pt-BR']
at://did:plc:i7us3xmoyezcuwtdgxzww4p7/app.bsky.feed.post/3luy77st2qc2k,bafyreibye6hs2bwlxhrwsui5ryeomgnl3nlbaao6dyy4ixt6ery4bcknyi,did:plc:i7us3xmoyezcuwtdgxzww4p7,clayzanfolin.bsky.social,Clayton,"Tenho um plano mais inteligente e sustentável para eles, quintal eles reflorestar parte deste deserto criado pelo agro, pois tenho certeza que a natureza vai equilibrar as coisas, ela já faz isso a milhares de anos e melhor de graça e com o efeito extra melhorar do clima e terá mais água disponível.",2025-07-27T23:11:29.294Z,0,0,1,2025-07-27T23:11:30.406Z,['pt']
at://did:plc:ex2mthxhfd542cfzxwdcjwxg/app.bsky.feed.post/3luy4qrd3pc24,bafyreiegzt7exquliy7zrm54grwrm74xgeke4jvst7f7nsf7pi52u7ag4m,did:plc:ex2mthxhfd542cfzxwdcjwxg,dioxavyer.bsky.social,Dio,"Parabéns filhos da puta do agro, caminhoneiros, e toda escória bolsonaristas e imbecis que voraram elegeram estes fascistas em SP, MG PR, RS, SC. 50% é pouco, vão se preparando...",2025-07-27T22:27:16.921Z,0,0,2,2025-07-27T22:24:18.410Z,['en']
at://did:plc:fndw4afrxnv2a7atjumixo7s/app.bsky.feed.post/3luy4dbwat22m,bafyreicreso7s4pgsjvcza44jwcvn55oroonou47tv6jg4qc72yjgksmmm,did:plc:fndw4afrxnv2a7atjumixo7s,mello1400.bsky.social,BelchimÓr 🚩,"Agro golpista do caralho!
#cadeiaparabolsonaro!
#bolsonaroPRESO2025!",2025-07-27T22:19:44.561Z,0,8,41,2025-07-27T22:20:02.503Z,['pt']
at://did:plc:cp4y6ge6a5kxymelu4n4rvoa/app.bsky.feed.post/3luy3bpbodv2h,bafyreifiixh6gkdaud2odjjgve4vnrhwut5ifbzm3tuav2apyksbnqqwjm,did:plc:cp4y6ge6a5kxymelu4n4rvoa,matediario.bsky.social,Mate Diario,Guillermo Francos defendió la baja en las retenciones al agro y confirmó que Milei vetará la ley de movilidad jubilatoria. Argumentó que el sistema de reparto no alcanza a cubrir los aumentos y criticó al kirchnerismo por el mal manejo de fondos.,2025-07-27T22:00:57.613Z,0,0,0,2025-07-27T22:00:58.002Z,['es']
at://did:plc:b4lmy4ewwuaod7jmvubpp2li/app.bsky.feed.post/3luy2on7kak2n,bafyreigfu6vjl7uoyubycababkiwggqpsycftzvpejsosp6snmsbf7ufra,did:plc:b4lmy4ewwuaod7jmvubpp2li,hectorrbruzzone.bsky.social,Hector,"#Argentina Te comes la expansión relativa, económica, por agro y energéticos, desatendiendo cuestiones estratégicas de logística y desarrollo interno, como lo social en favor de la oligarquía y los especuladores financieros, tomando deuda con contradicción equilibrio fiscal falso",2025-07-27T21:50:18.018Z,0,0,1,2025-07-27T21:50:19.306Z,['es']
at://did:plc:h7ob3232gywn5bfsnc26xgce/app.bsky.feed.post/3luy24op3j22q,bafyreihbdhjqljupm4lhxymb5yihhfpwgaczenh5c5kwreqhcibpbmasjq,did:plc:h7ob3232gywn5bfsnc26xgce,nicolasschamne.bsky.social,Nicolas Schamne,"Para este gobierno, subirle $20.000 a los jubilados “rompe el país”, pero perdonarle $3.000 millones al agro no afecta el déficit. No es austeridad, es crueldad selectiva. No lo dicen, pero lo muestran: para ellos, los viejos sobran.",2025-07-27T21:40:15.597Z,6,23,34,2025-07-27T21:40:18.011Z,['es']
at://did:plc:jdp3laxzdalwg7zlou6d7a4l/app.bsky.feed.post/3luxzieydsc2u,bafyreibkqf2mmhv65gmszusm7a2zs5mziw7saiwm7p3rhqxvawt7tz3lvm,did:plc:jdp3laxzdalwg7zlou6d7a4l,lilidadie.bsky.social,@Lili,"del agro. Además habló de las elecciones en provincia de Buenos Aires: ""Hay gente que no se quedó conforme pero vamos a trabajar todos para el mismo lado"", dijo.",2025-07-27T21:28:49.947Z,0,0,0,2025-07-27T21:28:56.624Z,['es']
at://did:plc:765gwibhy5phwzu6fdw6pli3/app.bsky.feed.post/3luxytn66rk22,bafyreidy2k2a2ivq6kjjkp3jbecjkzdcthaxckxrpmo2p2la5ivnvnmbmy,did:plc:765gwibhy5phwzu6fdw6pli3,gabirela.bsky.social,Lady Galabriela,Acho q é sobre a fala do Tarcísio sim mas até o Rodrigo Constantino conseguiu fazer mais sentido que o bananinha… só q o RC foi BURRO pq ele mandou na cara dura um “foda-se a economia” acho q o agro não vai curtir,2025-07-27T21:17:18.262Z,1,0,0,2025-07-27T21:17:19.206Z,['en']
at://did:plc:lv7ceej7morknaom6mwobc7h/app.bsky.feed.post/3luxyfjofoc2s,bafyreibn2wwgd4tnyffqdh732axj7dxluzadfuspmnc6glsrkpyp43n7qe,did:plc:lv7ceej7morknaom6mwobc7h,innergeekdesigns.bsky.social,Inner Geek Designs,This limited environment seems so high variance based on your pills the person who won our lgs prerelease pulled gas for rw agro and went under everyone,2025-07-27T21:09:24.837Z,0,0,1,2025-07-27T21:09:23.903Z,['en']
at://did:plc:fsadmwvalezitj2wa5yfkhlh/app.bsky.feed.post/3luxwkcelq22t,bafyreicemkwcui6dyo4pmrrq2poamzt36crqykkxpoqyorvd2gyjsbkthy,did:plc:fsadmwvalezitj2wa5yfkhlh,rodrigodosreis.bsky.social,Rodrigo dos Reis,"O agro, a indústria e o empresariado têm algo a dizer sobre a atitude de Eduardo Bolsonaro nos Estados Unidos?",2025-07-27T20:36:17.465Z,0,0,2,2025-07-27T20:36:17.811Z,['de']
at://did:plc:dbxn4gux24fyxuylfdhvmzx4/app.bsky.feed.post/3luxvan4bw22o,bafyreiftxfn6z2mykpinvtoh32pbcolalnwpgm3a2nryfubrx3ewktc5pe,did:plc:dbxn4gux24fyxuylfdhvmzx4,makimademon.bsky.social,Fern,"Teve um q foi falar de imposto sobre num sei o q lá do agro e o Jones: ""isso daí é isento de cobrança"". E o tonto: ""não importa"". Tipo!? Meu mano??",2025-07-27T20:12:59.439Z,1,0,0,2025-07-27T20:13:00.705Z,['pt']
at://did:plc:cjgoqbu2kxgqlvkvoxhz2f7w/app.bsky.feed.post/3luxu5ztdgc2w,bafyreifz2sk64a6ylaxni5p4buscllhy6j6sf5fj7mayksc7p5i45p7h7u,did:plc:cjgoqbu2kxgqlvkvoxhz2f7w,nadleeh.bsky.social,tea area are day 💛🤍💜🖤,"Akusti Agro is even *more* of a gundam name than spelling it correctly 

anyway I'm uhh Edre Aireit which actually kind of sounds like an antagonists name and now I'm imagining that spelling any gundam character's name backwards flips their allegiances like a mirror universe clone",2025-07-27T19:53:38.374Z,0,0,2,2025-07-27T19:53:39.104Z,['en']
at://did:plc:vp44f3l2k53cc5urxdam3h2v/app.bsky.feed.post/3luxtuuyjie2k,bafyreifihohxlsioejgw4eikdw225plzuhkjbfo2ng4ttmd5fglje2tt4i,did:plc:vp44f3l2k53cc5urxdam3h2v,clarapralon.bsky.social,Clara 🌈,DESCE PRA NOSSA PRINCESA DO AGRO ANTROPOVA,2025-07-27T19:48:31.288Z,0,0,1,2025-07-27T19:48:31.504Z,[]
at://did:plc:6dtupt3vlfszcbdqjmzv56dj/app.bsky.feed.post/3luxtueqpgc2p,bafyreietf3rxni3xiqan4oz5wjbf2hldd5mpeyrqa4j3fyagn2mvbzrjvq,did:plc:6dtupt3vlfszcbdqjmzv56dj,fackindoom.bsky.social,nesaM Doom,"They go into a house or some shit near mine and I got a lot of nails to drop before I pull my agro side out and start openly calling them bitches. I can back back up to my yard and then it's just legal to get my knife in them.

I don't want ICE here.",2025-07-27T19:48:14.278Z,0,0,1,2025-07-27T19:48:15.307Z,['en']
at://did:plc:i7fxaijay7bnvkqdzd23ta4o/app.bsky.feed.post/3luxtn5kr2c2u,bafyreidd2j5ekvwg3naugas5omlsiig425ugwupu7qag7mq3ppepxyymay,did:plc:i7fxaijay7bnvkqdzd23ta4o,abelcngl.bsky.social,Abel,"Terre contrastée que la Charente-Maritime... ici plus qu'ailleurs encore, sortir du modèle agro-industriel, de la dépendance aux pesticides, est un défi énorme et nécessaire.",2025-07-27T19:44:11.861Z,0,0,0,2025-07-27T19:44:12.802Z,['fr']
at://did:plc:2ruar6rgum65burg5jwthixl/app.bsky.feed.post/3luxsyfaevo27,bafyreiah73vqlofmfe4wx3icgw7msrggpauwj5laypdalpf47nejpdlfhu,did:plc:2ruar6rgum65burg5jwthixl,cnn-brasil.bsky.social,CNN Brasil,Tarifas dos EUA: governo mapeia mercados para redirecionar produtos do agro,2025-07-27T19:32:35.157Z,0,3,5,2025-07-27T19:32:35.406Z,[]
at://did:plc:tlbbutstkz3vf746rzl7li32/app.bsky.feed.post/3luxsibipck2m,bafyreiejors65c25ggzrjpokqq4d2fqlrustgk7wodyohcaj6phx4nswfe,did:plc:tlbbutstkz3vf746rzl7li32,trapik.bsky.social,trapik,"comment qu'ils poussent , ces soi-disant  ""agro-carburants"" ....
ben , tout bêtement avec des engrais chimiques (pétrole) ...  et ouala , le tour de bonneteau est fait ...",2025-07-27T19:23:34.474Z,0,0,2,2025-07-27T19:23:34.904Z,['fr']
at://did:plc:7rp2nmaw77bz6t446s4gtr7q/app.bsky.feed.post/3luxrsikq7w2k,bafyreiaqv6khurt62lqfnc4wrteuutebo4g5jfv4aqkisdjhtfx2klrnny,did:plc:7rp2nmaw77bz6t446s4gtr7q,meleestatspod.bsky.social,Melee Stats,"28. Astro!= won Dojo Mr. Zombie, beating agro and João Duarte (Portugal)

29. Ashley won Warlock Punch, beating 20 Buttons Louise and Bram (MT)

30. HAWKS won LRA Start, beating deluxe and Milf Hunter (CenCal)",2025-07-27T19:11:23.684Z,1,0,1,2025-07-27T19:11:24.341Z,['en']
